new_words,seconds_trans,arousal_trans,valence_trans,happy_trans,angry_trans,nervous_trans,sad_trans,seconds2_trans,arousal2_trans,valence2_trans,happy2_trans,angry2_trans,nervous2_trans,sad2_trans
also potential for the government not being able to take care of the refugees they accepted because,185.0,3.0,2.333,1.0,1.333,1.0,1.0,185.0,3.0,2.667,1.0,1.0,2.0,1.0
of their because they did not prepare for that many refugees entering,190.0,3.0,2.333,1.0,1.333,1.0,1.0,190.0,3.0,2.333,1.0,1.0,2.333,1.0
the country and in addition to my,195.0,2.667,2.333,1.0,1.333,1.0,1.0,195.0,3.0,2.333,1.0,1.0,2.0,1.0
position I would like to assert that I would like to bring out the question of the,200.0,2.667,2.333,1.0,1.333,1.0,1.0,200.0,3.333,2.667,1.0,1.0,2.0,1.0
security of locals when we accepted at least to the Jeju Island or there enough,205.0,2.333,3.0,1.0,1.0,1.0,1.0,205.0,3.0,3.333,1.0,1.0,1.667,1.0
policies in hand to secure the,210.0,2.333,3.0,1.0,1.0,1.0,1.0,210.0,3.333,3.333,1.0,1.0,1.667,1.0
security security of locals and with respect to refugees coming,215.0,2.333,3.0,1.0,1.0,1.333,1.0,215.0,3.0,3.0,1.0,1.0,2.667,1.0
in so I would like to,220.0,2.667,3.0,1.0,1.0,1.333,1.0,220.0,3.333,3.0,1.0,1.0,2.333,1.0
I would like to say something against what she have just argued primarily,225.0,2.667,3.0,1.0,1.0,1.333,1.0,225.0,3.0,2.667,1.0,1.0,2.333,1.333
primarily she had what she has argued that South Korea,230.0,2.667,3.0,1.0,1.0,1.0,1.0,230.0,3.0,2.667,1.0,1.0,2.333,1.333
isn't all work isn't ready to accept these refugees however in considering an economic,235.0,2.667,3.0,1.0,1.0,1.0,1.0,235.0,3.0,2.667,1.0,1.0,2.0,1.333
standpoint and considering how the nation is stable South Korea in turn in terms of these already,240.0,2.667,3.0,1.0,1.0,1.0,1.0,240.0,3.0,2.667,1.0,1.0,2.667,1.333
has much more capable of accepting refugees than four examples some Nations who have already,245.0,2.667,3.0,1.0,1.0,1.0,1.0,245.0,3.0,2.333,1.0,1.0,2.0,1.333
I've talked to many refugees so and and humanitarian statement they at least,250.0,4.333,3.333,1.0,1.667,1.333,1.0,250.0,2.667,2.333,1.0,1.0,1.0,1.0
have a place to eat and to work which many of these refugees has not had the opportunity also,255.0,4.0,3.333,1.0,1.667,1.333,1.0,255.0,2.667,2.333,1.0,1.0,1.0,1.0
shares argued that South Korea is to hormones homogeneous and many people face,260.0,3.667,3.333,1.0,1.667,1.333,1.0,260.0,2.667,2.333,1.0,1.0,1.0,1.0
discrimination upon arriving South Korea however this power there,265.0,4.333,3.333,1.0,1.667,1.333,1.0,265.0,2.667,2.333,1.0,1.0,1.0,1.0
are if there is already a substantial amount of foreign foreign people and especially people,270.0,4.333,3.333,1.0,1.667,1.0,1.0,270.0,2.667,2.667,1.0,1.0,1.0,1.0
with Muslim backgrounds living in South South Korea and and therefore this,275.0,4.0,3.333,1.0,1.667,1.667,1.0,275.0,3.0,2.333,1.0,1.0,1.333,1.0
and there and this amount is much more than the 500 yemeni refugees and,280.0,4.0,3.333,1.0,1.667,2.0,1.0,280.0,3.0,2.333,1.0,1.0,1.333,1.0
also she has argued that they should be accepted after South Korea's ready for,285.0,3.667,3.0,1.0,1.667,2.0,1.0,285.0,2.667,2.333,1.0,1.0,1.333,1.0
accepting refugees however that this means that the 500 yemenis,290.0,3.667,3.0,1.0,1.667,1.333,1.0,290.0,2.667,2.333,1.0,1.0,1.333,1.0
refugees or maybe a huge portion of them like what happened now has,295.0,3.667,3.0,1.0,1.667,1.333,1.0,295.0,2.667,2.333,1.0,1.0,1.333,1.0
has to or we have to only have a temporary status or where either be returned to Yemen,300.0,3.667,3.0,1.0,1.667,1.333,1.0,300.0,2.667,2.333,1.0,1.0,1.333,1.0
how this however they have already paid the potential amount and paid a huge,305.0,4.0,3.333,1.0,1.667,1.333,1.0,305.0,2.667,2.333,1.0,1.0,1.333,1.0
risk for for arriving to South Korea and putting them back,310.0,4.0,3.0,1.0,1.667,1.333,1.0,310.0,2.667,2.333,1.0,1.0,1.333,1.0
is against humanitarian obligations at South Korea has a week to follow,315.0,3.667,3.0,1.0,1.667,1.667,1.0,315.0,2.667,2.333,1.0,1.0,1.333,1.0
as a developed country,320.0,3.667,3.0,1.0,1.667,1.333,1.0,320.0,2.667,2.333,1.0,1.0,1.333,1.0
I like to disagree on how he said that Korea,325.0,4.0,3.333,1.0,1.667,1.333,1.0,325.0,2.667,2.333,1.0,1.0,1.333,1.0
is economically and economically and just stable in general,330.0,4.0,3.333,1.0,1.667,1.0,1.0,330.0,2.667,2.333,1.0,1.0,1.333,1.0
which you stated Korea is that state of war the war between South Korea and,335.0,4.0,3.333,1.0,1.667,2.0,1.0,335.0,2.667,2.333,1.0,1.0,1.667,1.0
North Korea has not ended since since 1945 the,340.0,4.0,3.333,1.0,1.667,1.333,1.0,340.0,2.667,2.333,1.0,1.0,1.667,1.0
which the war started after World War 2 so which is around that time all,345.0,4.0,3.333,1.0,2.0,1.667,1.0,345.0,2.667,2.333,1.0,1.0,1.667,1.0
the men in Korea go to a military our Force our are required,350.0,4.0,3.333,1.0,2.0,1.667,1.0,350.0,2.667,2.333,1.0,1.0,1.667,1.0
to go to military because of the situation I believe that the situation is hardly stable,355.0,4.0,3.333,1.0,2.0,1.667,1.0,355.0,3.667,3.0,1.333,1.0,1.667,1.0
and also you said that because there are many people of Muslim background in Korea,360.0,3.0,3.0,1.0,2.0,1.333,1.0,360.0,4.0,3.0,1.333,1.0,1.667,1.0
people in Korea are prepared to accept refugees well I would like to say I,365.0,2.667,2.667,1.0,1.667,1.0,1.0,365.0,4.0,3.0,1.333,1.0,1.667,1.0
disagree that with you because although there are many people,370.0,2.667,2.667,1.0,1.667,1.0,1.0,370.0,4.0,2.667,1.333,1.0,2.0,1.0
of foreign background in Korea I believe that they have not integrated well into the society,375.0,2.667,2.667,1.0,1.667,1.0,1.0,375.0,3.333,3.333,1.333,1.0,1.667,1.0
well just seeing the Christ Community of the separation between the international population,380.0,2.667,2.667,1.0,1.667,1.0,1.0,380.0,4.0,3.333,1.333,1.0,2.0,1.0
and the Korean population I believe that further education and some campaigning,385.0,2.667,2.667,1.0,1.667,1.0,1.0,385.0,3.667,3.333,1.333,1.0,1.667,1.0
is needed to prepare the Korean citizens to accept,390.0,2.667,2.667,1.0,1.667,1.333,1.0,390.0,3.333,3.0,1.333,1.0,2.0,1.0
those refugees and except on racially different people into their society,395.0,2.667,2.667,1.0,1.667,1.333,1.0,395.0,3.333,3.0,1.333,1.0,2.0,1.0
and in terms of humanitarian Aid I believe that I agree with,400.0,2.667,2.667,1.0,1.333,1.333,1.0,400.0,3.333,3.333,1.333,1.0,1.667,1.0
you that if the Korea has the necessary means they should provide,405.0,2.667,2.667,1.0,1.333,1.333,1.0,405.0,3.667,3.333,1.333,1.0,1.667,1.0
humanitarian Aid however,410.0,2.667,2.667,1.0,1.333,1.0,1.0,410.0,3.333,3.333,1.333,1.0,1.667,1.0
because of the situations that I said beforehand I believe that Korea is not prepared,415.0,2.667,2.667,1.0,1.333,1.0,1.0,415.0,3.333,3.333,1.333,1.0,1.667,1.0
to accept that many refugees and if the nation cannot provide for those refugees they cannot,420.0,2.667,2.667,1.0,1.333,1.0,1.0,420.0,3.333,3.333,1.333,1.0,1.667,1.0
they should not try to accept as refugees if they cannot care for them that well,425.0,3.0,2.667,1.0,1.333,1.333,1.0,425.0,3.667,3.333,1.333,1.0,1.667,1.0
so I would like,430.0,3.0,2.667,1.0,1.333,1.333,1.0,430.0,3.667,3.333,1.333,1.0,1.667,1.0
to add some points to what she has are good to begin with she has,435.0,3.0,2.667,1.0,1.333,1.0,1.0,435.0,3.333,3.333,1.333,1.0,1.667,1.0
argued that South Korea is in the very economic very is a very interested,440.0,3.0,2.667,1.0,1.333,1.0,1.0,440.0,3.333,3.333,1.333,1.0,1.667,1.0
in stable Nation considering the war between North Korea and South Korea Korea is in,445.0,2.667,2.667,1.0,1.333,1.333,1.0,445.0,3.0,2.667,1.333,1.0,2.0,1.0
a state of war in Korea it and Korean men are upload jacket military and,450.0,2.333,3.0,1.0,1.0,1.333,1.0,450.0,3.333,2.667,1.333,1.0,2.0,1.0
of course Northeast Asia as a German South Korea North Korea General is very in stable place in the political,455.0,2.333,3.0,1.0,1.0,1.333,1.0,455.0,3.0,2.333,1.333,1.0,2.333,1.0
view however South Korea still has signed signed the 1991,460.0,2.333,3.0,1.0,1.0,1.333,1.0,460.0,3.333,2.667,1.333,1.0,2.0,1.0
convention on refugees and this have argued eyes this I do own this employees that,465.0,2.333,3.0,1.0,1.0,1.333,1.0,465.0,3.667,2.667,1.333,1.0,2.0,1.0
are usually South Korea has only hastening sign scientists in order to,470.0,2.667,3.0,1.0,1.0,1.667,1.0,470.0,3.0,2.667,1.333,1.0,2.0,1.0
gain some in order to gain some status as a developed country,475.0,3.333,2.667,1.0,1.0,2.0,1.0,475.0,3.667,2.667,1.333,1.0,2.0,1.0
towards the fact that South Korea is capable of accepting a substantial amount to procure,480.0,3.333,2.667,1.0,1.0,2.0,1.0,480.0,3.333,2.667,1.0,1.333,1.0,1.0
geez and I would like to further I would like to further,485.0,3.0,2.667,1.0,1.333,2.0,1.0,485.0,3.333,2.667,1.0,1.333,1.0,1.0
clarify my remaining art when South Korea should not should not be focused,490.0,3.667,2.667,1.0,1.333,2.0,1.0,490.0,2.667,2.667,1.0,1.333,1.0,1.0
on their own intent on internal struggle even though their heart South Korea is a nation,495.0,3.0,2.667,1.0,1.333,2.0,1.0,495.0,2.667,2.667,1.333,1.0,1.0,1.0
that is a nation that that focuses on,500.0,3.333,3.0,1.0,1.333,1.667,1.0,500.0,3.333,2.667,1.333,1.0,1.0,1.0
export and an agent that should be able to and and personally I think that,505.0,3.333,3.0,1.0,1.333,1.667,1.0,505.0,2.667,2.667,1.333,1.0,1.0,1.0
South Korea should be a nation that tries to resolve International conflict and tries to,510.0,3.333,3.0,1.0,1.333,2.0,1.0,510.0,2.667,2.667,1.333,1.0,1.0,1.0
integrate say previous,515.0,3.0,3.0,1.0,1.333,2.0,1.0,515.0,2.667,2.333,1.0,1.667,1.0,1.0
I tried to and try to put interested,520.0,3.0,2.667,1.0,1.333,2.333,1.0,520.0,2.667,2.333,1.0,1.667,1.0,1.0
in other and Global struggles and too,525.0,3.0,2.667,1.0,1.333,2.333,1.0,525.0,2.667,2.333,1.0,1.667,1.0,1.0
and recording,530.0,3.0,2.667,1.0,1.333,2.333,1.0,530.0,3.0,2.333,1.0,1.667,1.0,1.0
regarding Refugee status die,535.0,3.0,3.0,1.0,1.333,2.0,1.0,535.0,3.0,2.333,1.0,1.667,1.0,1.0
I,540.0,3.333,3.0,1.0,1.667,1.667,1.0,540.0,3.0,2.333,1.0,1.667,1.0,1.0
believe that our country should not,545.0,3.333,3.0,1.0,1.667,1.667,1.0,545.0,2.667,2.333,1.0,1.667,1.0,1.0
be,550.0,3.333,2.667,1.0,1.667,2.0,1.0,550.0,2.667,2.333,1.0,1.667,1.0,1.0
the time I'll start okay so I'm against,5.0,2.667,3.333,2.333,1.0,2.0,1.0,5.0,3.0,3.333,2.333,1.0,2.0,1.0
the integration of refugees to Korea so,10.0,2.667,3.667,2.333,1.0,2.0,1.0,10.0,3.0,3.333,2.333,1.0,2.0,1.0
my main point is I 3 main points firstly,15.0,3.0,3.667,2.333,1.0,2.0,1.0,15.0,3.0,3.333,2.333,1.0,2.0,1.0
I think it's important to take care of the Korean Nationals first and,20.0,2.667,3.333,2.333,1.0,2.0,1.0,20.0,3.0,3.333,2.333,1.0,2.0,1.0
then look after the refugee refugees I know it's a great thing to help other people,25.0,2.333,3.0,2.333,1.0,2.0,1.0,25.0,3.0,3.333,2.0,1.0,2.0,1.0
and the gospel others but I think it's more important to look after our,30.0,2.333,3.0,2.333,1.0,2.0,1.0,30.0,3.0,3.333,2.333,1.0,2.0,1.0
people first so if we look at an example of since breathtaking refugees is kind of a big,35.0,2.333,3.0,2.333,1.0,1.667,1.0,35.0,2.333,3.333,2.0,1.0,2.0,1.0
boundary if we look this into small boundary I think we can compare it with,40.0,2.333,3.0,2.333,1.0,1.667,1.0,40.0,3.0,3.333,2.333,1.0,1.667,1.0
a family so let's say the young family was ten,45.0,2.0,3.0,2.333,1.0,1.667,1.0,45.0,3.0,3.333,2.0,1.0,1.667,1.0
children and I'm not that wealthy and some of the children are getting enough food and,50.0,2.0,3.0,2.333,1.0,1.667,1.0,50.0,3.0,3.333,2.0,1.0,1.667,1.0
some aren't some are getting a good education but some are we the education at have,55.0,2.333,3.0,2.0,1.0,1.667,1.0,55.0,3.0,3.333,2.0,1.0,1.667,1.0
a bad environment for upbringing but just because,60.0,2.333,3.0,2.0,1.0,1.667,1.0,60.0,2.333,3.0,1.667,1.0,1.667,1.0
other wealthy families are taking adopting children,65.0,1.667,3.0,2.0,1.0,1.667,1.0,65.0,2.333,3.0,1.667,1.0,1.667,1.0
adopting is a great thing to do on these things have children and it's great,70.0,2.0,3.0,2.0,1.0,1.333,1.0,70.0,2.333,3.0,1.667,1.0,1.667,1.0
but would it be good to take in children,75.0,1.667,3.0,2.0,1.0,1.333,1.0,75.0,2.333,3.0,1.667,1.0,1.667,1.0
adopt children when you can't even take care of your own children properly,80.0,1.667,3.0,2.0,1.0,1.667,1.0,80.0,2.333,3.0,1.667,1.0,1.667,1.0
so I think it's best thing is to take care of our children,85.0,2.0,3.0,2.0,1.0,1.667,1.0,85.0,2.333,3.0,2.0,1.0,1.667,1.0
Fist and then look off balance so that's my first point and,90.0,1.667,3.0,2.0,1.0,1.667,1.0,90.0,2.333,3.333,1.667,1.0,1.667,1.0
my second point is that the people are mainly,95.0,1.667,3.0,2.0,1.0,1.667,1.0,95.0,2.333,3.0,1.667,1.0,1.667,1.0
Muslim and it's not to do with race I'm not being,100.0,1.667,3.0,2.0,1.0,1.667,1.0,100.0,2.333,3.0,1.667,1.0,1.667,1.0
I'm not being racist in the fact that,105.0,2.333,3.0,2.0,1.0,2.333,1.0,105.0,2.333,3.0,1.667,1.0,1.667,1.0
I think it's to do with the cultural thing,110.0,2.333,3.0,2.0,1.0,2.333,1.0,110.0,2.333,3.0,1.667,1.0,1.667,1.0
and,115.0,2.333,3.0,2.0,1.0,2.333,1.0,115.0,2.333,3.0,1.667,1.0,1.667,1.0
okay so if I'm I'm for immigration I guess so,120.0,2.667,3.0,2.0,1.0,2.333,1.0,120.0,2.333,3.0,1.667,1.0,1.667,1.0
let me just address your first point about taking care of Korean Nationals first,125.0,2.667,3.0,2.0,1.0,2.0,1.0,125.0,2.667,3.0,2.0,1.0,1.667,1.0
so yeah Korea should take care of their Nationals as well,130.0,2.667,3.0,2.0,1.0,2.0,1.0,130.0,2.667,3.0,2.0,1.0,1.667,1.0
but just because you know having refugees,135.0,3.333,3.0,1.667,1.0,1.667,1.0,135.0,3.667,3.333,2.333,1.0,2.333,1.0
who are applying for jobs that it could go to Koreans doesn't necessarily mean that they're not taking,140.0,3.0,3.0,1.667,1.0,1.667,1.0,140.0,3.667,3.667,2.333,1.0,2.333,1.0
care of Koreans in a way because what if those what if Koreans don't want those jobs,145.0,2.333,3.0,1.667,1.0,1.333,1.0,145.0,3.667,3.667,2.667,1.0,2.0,1.0
than all those small menial jobs would just then go to refugees and in a way it would help Korean,150.0,2.333,3.0,1.667,1.0,1.333,1.0,150.0,3.667,3.667,2.667,1.0,2.0,1.0
society and just because creating some creating Nationals are poor that's not the fault,155.0,3.0,3.0,1.667,1.0,1.333,1.0,155.0,3.667,3.667,2.333,1.0,1.667,1.0
of the government maybe it's the fault of the of the person of,160.0,2.0,2.667,1.667,1.0,1.667,1.0,160.0,3.667,3.333,2.333,1.0,1.667,1.0
the LOL it's maybe their own motivation that they lost so that they can't find a job they can't take,165.0,3.0,2.667,1.667,1.0,1.667,1.0,165.0,3.333,3.0,2.333,1.0,1.667,1.0
care of themselves and also for a second point,170.0,3.0,2.667,1.667,1.333,1.667,1.0,170.0,3.333,3.0,2.0,1.0,1.667,1.0
I think I have an idea of where you were going and to be honest Muslims,175.0,3.0,2.667,1.667,1.333,1.667,1.0,175.0,3.333,3.0,2.333,1.0,1.667,1.0
are actually considered one of the religions that is very well respected and,180.0,3.0,3.667,1.667,1.667,1.667,1.0,180.0,3.333,3.0,2.333,1.0,1.333,1.0
culturally they keep a lot of ground rules but those people extremists,185.0,2.0,3.667,1.667,1.667,1.667,1.0,185.0,3.333,3.0,2.333,1.0,1.333,1.0
are the ones who don't stick to those rules and want to add more rules of their own,190.0,2.667,3.667,1.667,1.667,1.667,1.0,190.0,3.0,3.0,2.333,1.0,1.333,1.0
to that religion so it's not necessarily religious wise,195.0,2.667,3.667,1.667,1.667,1.667,1.0,195.0,2.667,3.0,2.333,1.0,1.333,1.0
and I think that,200.0,2.667,3.667,1.667,1.667,1.667,1.0,200.0,2.667,3.0,2.333,1.0,1.333,1.0
Korea as a homogeneous society should actually become a little bit more heterogeneous and more,205.0,2.333,3.333,1.667,1.667,1.333,1.0,205.0,2.667,3.0,2.333,1.0,1.333,1.0
of a cultural Melting Pot like other First World countries yeah I think that's,210.0,2.667,3.333,1.667,1.667,1.333,1.0,210.0,2.667,3.0,2.333,1.0,1.333,1.0
it so yours you said that the poor people in Korea,215.0,2.667,3.333,1.667,1.667,1.333,1.0,215.0,2.667,3.0,2.333,1.0,1.333,1.0
are the fault of their own and it's not the government that's what you said and I agree that some,220.0,2.667,3.0,1.667,1.333,1.333,1.0,220.0,2.667,3.0,2.333,1.0,1.333,1.0
people in might be the case for some people that,225.0,2.667,3.0,1.667,1.333,1.333,1.0,225.0,2.667,3.0,2.333,1.0,1.333,1.0
I was brought up in the UK and the situation will be different there,230.0,2.667,3.0,1.667,1.333,1.333,1.0,230.0,2.667,3.0,2.333,1.0,1.333,1.0
is still poor people in Britain but the government,235.0,2.333,2.667,1.667,1.333,1.333,1.0,235.0,3.0,3.0,2.333,1.0,1.333,1.0
helping the poor people is extremely different from Korea and victim,240.0,2.667,2.667,2.0,1.0,1.333,1.0,240.0,3.333,3.333,2.0,1.0,1.0,1.0
I think the government isn't doing enough to help the disabled,245.0,3.333,2.667,2.0,1.0,1.333,1.0,245.0,3.333,3.667,2.333,1.0,1.0,1.0
or the,250.0,3.333,2.667,2.0,1.0,1.333,1.0,250.0,3.667,3.333,2.0,1.0,1.0,1.0
old people old people and eventually he'll Etc and people,255.0,3.667,2.667,2.0,1.0,1.333,1.0,255.0,3.333,3.333,2.0,1.0,1.0,1.0
who need help from the government who can't sustain the,260.0,3.667,3.0,2.0,1.0,1.333,1.0,260.0,3.333,3.333,2.0,1.0,1.0,1.0
can't help themselves who need help I think that,265.0,3.667,3.0,2.0,1.0,1.333,1.0,265.0,3.333,3.333,2.0,1.0,1.0,1.0
the government needs to help them more and I'm you said that extreme people add,270.0,3.667,2.667,1.667,1.0,1.667,1.0,270.0,3.0,3.333,2.0,1.0,1.0,1.0
more rule to the religion do you have you study the Cora,275.0,4.0,2.667,1.667,1.0,1.667,1.0,275.0,3.333,3.333,2.0,1.0,1.0,1.0
have you studied can't help themselves through need help I think that the government needs to help them more and and you said that extreme people add more rule to the religion do you how do you study the Koran have you studied Muslim religion because I studied the religion,280.0,3.667,2.667,2.0,1.0,2.0,1.0,280.0,3.0,3.333,2.0,1.0,1.0,1.0
because in the UK this is in GCSE we select subjects,285.0,3.667,2.667,2.0,1.0,2.0,1.0,285.0,3.333,3.333,2.333,1.0,1.0,1.0
and I selected religion I'm that about Muslims and the Quran and the Quran,290.0,3.333,2.667,2.0,1.0,1.667,1.0,290.0,3.0,3.0,2.333,1.0,1.0,1.0
I can't cook the crumbs I don't remember the exact words but it says,295.0,4.0,2.667,2.0,1.0,1.667,1.0,295.0,3.0,3.0,2.333,1.0,1.0,1.0
to kill non-muslims and kill the,300.0,3.667,2.667,2.0,1.0,1.333,1.0,300.0,3.0,3.0,2.0,1.0,1.0,1.0
gays kill the tried convert everyone to Muslim if they don't,305.0,3.333,2.667,1.667,1.0,1.333,1.0,305.0,3.0,3.0,2.0,1.0,1.0,1.0
convert kill them and go to a different country,310.0,3.333,2.667,1.667,1.0,1.333,1.0,310.0,3.0,3.0,2.0,1.0,1.0,1.0
and marry their people and have as many children children,315.0,3.333,2.667,1.667,1.0,1.333,1.0,315.0,3.0,3.0,2.0,1.0,1.0,1.0
and they make them all Muslim and attack on Muslims and if you kill someone because,320.0,3.0,2.667,1.667,1.0,1.333,1.0,320.0,3.0,3.0,2.0,1.0,1.0,1.0
of the religion you go to heaven okay,325.0,3.0,2.667,1.667,1.0,1.333,1.0,325.0,2.333,3.0,2.0,1.0,1.0,1.0
rebuttal time okay first I'll address your welfare,330.0,2.667,2.667,1.667,1.0,1.333,1.0,330.0,2.667,3.0,2.0,1.0,1.0,1.0
comment yeah so I think I,335.0,2.667,2.667,1.667,1.0,1.667,1.0,335.0,2.667,3.0,2.0,1.0,1.0,1.0
would agree with you maybe you came would have a better welfare situation,340.0,2.333,2.667,1.667,1.0,1.667,1.0,340.0,2.667,3.0,2.0,1.0,1.0,1.0
and comparisons to Korea right because Korean government,345.0,2.333,2.667,1.667,1.0,1.667,1.0,345.0,2.667,3.0,2.0,1.0,1.0,1.0
doesn't really do doesn't really care about the disabled disabled or mentally challenged,350.0,2.333,2.667,1.667,1.0,1.667,1.0,350.0,2.667,2.667,2.0,1.0,1.333,1.0
all the older generation and I agree with that but that's all in the government,355.0,2.333,2.667,1.667,1.0,1.667,1.0,355.0,2.333,2.667,2.0,1.0,1.333,1.0
instead of actually protesting against immigration they should actually be protesting,360.0,2.333,2.667,1.667,1.0,1.667,1.0,360.0,2.667,3.333,2.333,1.0,1.0,1.0
for you know rights for welfare status fixing everything,365.0,2.0,2.667,1.667,1.0,1.667,1.0,365.0,2.667,3.333,2.333,1.0,1.0,1.0
helping the mentally disabled helping the people helping the older generation maybe with pension,370.0,2.333,2.667,1.667,1.0,1.667,1.0,370.0,2.667,3.333,2.0,1.0,1.0,1.0
or well first raishin they should actually be protesting for you know rights for welfare status fixing everything helping the mentally disabled helping the people helping the older generation maybe with pension or welfare status that's what they should be fighting for instead of immigration as well,375.0,2.0,2.667,1.667,1.0,1.667,1.0,375.0,2.333,3.333,2.333,1.0,1.333,1.0
for a religion otherwise just because the coroner says to kill non-muslims,380.0,2.0,2.667,1.667,1.0,1.667,1.0,380.0,2.333,3.333,2.0,1.0,1.333,1.0
it's like the Bible they're like Stone everybody who is a sinner or stone people who don't,385.0,2.0,2.667,1.667,1.0,1.667,1.0,385.0,2.333,3.0,2.333,1.0,1.333,1.0
who's not Christian they still don't know it's just for her alligator,390.0,2.0,2.667,1.667,1.0,1.667,1.0,390.0,2.333,3.0,2.333,1.0,1.333,1.0
no way to Christian Stone them no Chris no but,395.0,2.0,2.667,1.667,1.0,1.667,1.0,395.0,2.333,3.0,2.333,1.0,1.333,1.0
but what about this Showcase of buildings Stone women who don't wear,400.0,2.0,2.667,1.667,1.0,1.667,1.0,400.0,2.333,3.0,2.333,1.0,1.333,1.0
the hijab that's only the extreme extreme ignore how do you know they're,405.0,2.0,2.667,1.667,1.0,1.667,1.0,405.0,2.333,3.0,2.333,1.0,1.333,1.0
only the extremist why isn't there any Christian extremist who do that throw stones,410.0,2.0,2.667,1.667,1.0,1.667,1.0,410.0,2.333,3.0,2.333,1.0,1.333,1.0
at the case kill people who commit adultery,415.0,2.0,2.667,1.667,1.0,1.667,1.0,415.0,2.333,3.0,2.333,1.0,1.333,1.0
it says in the Bible to kill Stone but that's only,420.0,2.333,3.0,1.333,1.333,2.0,1.0,420.0,3.333,3.333,2.0,1.667,2.333,1.0
a morality thing yeah to Christians as some of your morality did you see American,425.0,2.333,3.0,1.333,1.333,2.0,1.0,425.0,3.333,3.333,2.0,1.667,2.333,1.0
Muslims killing with non-muslims know you don't that would be an everyday occurrence in America,430.0,3.667,3.0,1.333,1.333,2.0,1.0,430.0,3.333,3.333,2.0,1.667,2.333,1.0
exactly so I don't think it all but not all of them follow,435.0,3.0,2.667,1.333,1.333,2.0,1.0,435.0,3.667,3.333,2.0,2.0,2.333,1.0
but,440.0,3.667,2.667,1.667,1.667,2.0,1.0,440.0,3.667,3.333,2.0,1.667,2.333,1.0
are they actually call themselves Muslims or do,445.0,3.667,2.667,1.667,1.667,2.0,1.0,445.0,3.333,3.0,2.0,1.667,2.333,1.0
they call themselves another word for their terrorist group it depends,450.0,4.0,3.0,1.667,1.667,2.0,1.0,450.0,3.0,3.0,2.0,1.667,2.333,1.0
they call themselves Muslims so you're saying that terrorist,455.0,4.0,3.0,1.667,2.0,2.0,1.0,455.0,3.0,3.0,1.667,1.667,2.333,1.0
people don't call themselves Muslims some don't some were just,460.0,3.667,3.667,1.667,2.0,2.0,1.0,460.0,3.0,3.0,1.667,1.667,2.333,1.0
a group that there were an activist are trying to defend their own country and then they ended up,465.0,3.667,3.333,1.667,2.0,1.667,1.0,465.0,3.0,3.0,2.0,1.667,2.333,1.0
getting the support of America and they became this huge terrorist groups like,470.0,3.667,3.333,1.667,2.0,1.667,1.0,470.0,3.333,3.333,2.0,1.667,2.333,1.0
for example Isis,475.0,3.333,3.0,1.667,2.0,2.0,1.0,475.0,3.0,3.333,2.0,1.667,2.333,1.0
so how is Isis so huge where is happening make money they got,480.0,3.333,3.0,1.667,1.667,2.0,1.0,480.0,3.0,2.667,2.0,1.667,2.333,1.0
their first support from the US and then when Saddam Hussein died,485.0,3.333,3.0,1.667,1.667,2.0,1.0,485.0,3.0,3.0,1.667,1.667,2.333,1.0
they go bigger how did they grew bigger where did they get all the equipment the weapons,490.0,3.333,3.0,1.667,1.667,2.0,1.0,490.0,3.0,2.667,1.667,1.667,2.333,1.0
they got the Weaponry from the America before before said I was saying died so they,495.0,3.333,3.0,1.667,1.667,2.0,1.0,495.0,3.0,2.667,1.667,1.667,2.333,1.0
got all the weapons before silencing and they're still have those weapons,500.0,3.333,3.0,1.667,1.667,2.0,1.0,500.0,3.0,3.0,1.667,1.667,2.333,1.0
yeah and then they sell was weapons being fine they gain followers followers make - definitely a huge support,505.0,3.333,3.0,1.667,1.667,2.0,1.0,505.0,3.0,2.667,1.667,1.667,2.333,1.0
from some certain government and most people assume that it's from Saudia,510.0,3.333,3.0,1.667,1.667,2.0,1.0,510.0,3.0,3.0,1.667,1.667,2.333,1.0
Arabia now it's prob maybe Saudi Arabia but in the beginning are why is Sandy Arabia,515.0,3.0,3.333,1.667,1.667,2.0,1.0,515.0,3.0,2.667,1.667,2.333,2.333,1.0
supporting the Isis because the Muslim Brotherhood,520.0,3.0,3.0,1.333,1.667,2.0,1.0,520.0,3.0,2.667,1.667,1.667,2.333,1.0
the Muslim idea what Isis is doing is they're doing exactly,525.0,3.0,3.667,1.333,1.667,2.0,1.0,525.0,3.667,3.333,2.0,1.667,2.333,1.0
what the Quran is very saying then what is a bomb their own mosque,530.0,3.0,3.333,1.333,1.667,2.0,1.0,530.0,3.333,3.0,1.667,1.667,2.333,1.0
they didn't bomb their own laws they terrorize their own walk and it's not like every Muslim,535.0,3.0,3.333,1.333,1.667,2.0,1.0,535.0,3.333,3.0,1.667,1.667,2.333,1.0
is a terrorist if everyone's,540.0,3.333,3.333,1.333,1.667,2.0,1.0,540.0,3.333,3.0,1.667,1.667,2.333,1.0
I'm saying terrorists are Muslim but not every,545.0,3.333,3.333,1.333,1.667,2.0,1.0,545.0,3.333,3.0,2.0,1.667,2.333,1.0
Muslim is a terrorist then not every terrorist is a Muslim,550.0,3.333,3.0,1.667,1.333,1.667,1.0,550.0,3.333,3.0,2.0,1.667,2.333,1.0
look the most terrorists are Muslim but then they,555.0,3.333,3.0,1.667,1.333,1.667,1.0,555.0,3.333,3.0,2.0,1.667,2.333,1.0
do we tap whose turn is it 10,560.0,3.333,3.0,1.667,1.333,1.333,1.0,560.0,3.667,3.0,1.667,1.333,2.333,1.0
first these refugees came,5.0,2.667,3.333,1.333,1.0,1.0,1.0,5.0,1.667,2.667,1.0,1.0,1.333,1.0
